keyword_ref	iteration	video_id	url	title	description	keywords	image	type	paid	channel_id	duration	unlisted	family	regions	views	date_publication	date_upload	genre	like	dislike	next_video_id	next_video_url	reco_videos_id	reco_urls	reco_titles	reco_channels_id	reco_channels_name	reco_durations	reco_views	reco_ages_month	reco_snippets
patrick moore	54	SBjtO-0tbKU	https://www.youtube.com/watch?v=SBjtO-0tbKU	The reality of climate change | David Puttnam | TEDxDublin	This talk was given at a local TEDx event, produced independently of the TED Conferences. David Puttnam looks at Climate Change through different lenses, all...	ted; International Affairs; Global Issues; History; TEDxTalks; Ireland; tedx talks; ted talks; tedx talk; Economics; Politics; English; ted talk; tedx; Clima...	https://i.ytimg.com/vi/SBjtO-0tbKU/hqdefault.jpg	video.other	False	UCsT0YIqwnpJCM-mx7-gSA4Q	PT16M35S	False	True	AD;AE;AF;AG;AI;AL;AM;AO;AQ;AR;AS;AT;AU;AW;AX;AZ;BA;BB;BD;BE;BF;BG;BH;BI;BJ;BL;BM;BN;BO;BQ;BR;BS;BT;BV;BW;BY;BZ;CA;CC;CD;CF;CG;CH;CI;CK;CL;CM;CN;CO;CR;CU;CV;CW;CX;CY;CZ;DE;DJ;DK;DM;DO;DZ;EC;EE;EG;EH;ER;ES;ET;FI;FJ;FK;FM;FO;FR;GA;GB;GD;GE;GF;GG;GH;GI;GL;GM;GN;GP;GQ;GR;GS;GT;GU;GW;GY;HK;HM;HN;HR;HT;HU;ID;IE;IL;IM;IN;IO;IQ;IR;IS;IT;JE;JM;JO;JP;KE;KG;KH;KI;KM;KN;KP;KR;KW;KY;KZ;LA;LB;LC;LI;LK;LR;LS;LT;LU;LV;LY;MA;MC;MD;ME;MF;MG;MH;MK;ML;MM;MN;MO;MP;MQ;MR;MS;MT;MU;MV;MW;MX;MY;MZ;NA;NC;NE;NF;NG;NI;NL;NO;NP;NR;NU;NZ;OM;PA;PE;PF;PG;PH;PK;PL;PM;PN;PR;PS;PT;PW;PY;QA;RE;RO;RS;RU;RW;SA;SB;SC;SD;SE;SG;SH;SI;SJ;SK;SL;SM;SN;SO;SR;SS;ST;SV;SX;SY;SZ;TC;TD;TF;TG;TH;TJ;TK;TL;TM;TN;TO;TR;TT;TV;TW;TZ;UA;UG;UM;US;UY;UZ;VA;VC;VE;VG;VI;VN;VU;WF;WS;YE;YT;ZA;ZM;ZW	557571	2014-12-01	2014-12-01	Nonprofits & Activism	6401	1649	/watch?v=N-yALPEpV4w	https://www.youtube.com/watch?v=/watch?v=N-yALPEpV4w	N-yALPEpV4w;3WMuzhQXJoY;8S0FDjFBj8o;4-079YIasck;7vnzKPq390Q;_YNfA7mDri4;nVRco_eLjdc;A9UmdY0E8hU;VPB5w5FECf8;VNGFep6rncY;MdZAMSyn_As;fNxctzyNxC0;pF72px2R3Hg;8s3bdVxuFBs;zXCiv4sc5eY;hqKafI7Amd8;esPRsT-lmw8;_pUtz75lNaw;DBTb71UzPmY;PXwStduNw14	https://www.youtube.com/watch?v=N-yALPEpV4w;https://www.youtube.com/watch?v=3WMuzhQXJoY;https://www.youtube.com/watch?v=8S0FDjFBj8o;https://www.youtube.com/watch?v=4-079YIasck;https://www.youtube.com/watch?v=7vnzKPq390Q;https://www.youtube.com/watch?v=_YNfA7mDri4;https://www.youtube.com/watch?v=nVRco_eLjdc;https://www.youtube.com/watch?v=A9UmdY0E8hU;https://www.youtube.com/watch?v=VPB5w5FECf8;https://www.youtube.com/watch?v=VNGFep6rncY;https://www.youtube.com/watch?v=MdZAMSyn_As;https://www.youtube.com/watch?v=fNxctzyNxC0;https://www.youtube.com/watch?v=pF72px2R3Hg;https://www.youtube.com/watch?v=8s3bdVxuFBs;https://www.youtube.com/watch?v=zXCiv4sc5eY;https://www.youtube.com/watch?v=hqKafI7Amd8;https://www.youtube.com/watch?v=esPRsT-lmw8;https://www.youtube.com/watch?v=_pUtz75lNaw;https://www.youtube.com/watch?v=DBTb71UzPmY;https://www.youtube.com/watch?v=PXwStduNw14	Why renewables canÃ¢Â Â t save the planet | Michael Shellenberger | TEDxDanubia;MEETING THE ENEMYÂ A feminist comes to terms with the Men's Rights movement | Cassie Jaye | TEDxMarin;How to sound smart in your TEDx Talk | Will Stephen | TEDxNewYork;Master Shi Heng Yi Ã¢Â Â 5 hindrances to self-mastery | Shi Heng YI | TEDxVitosha;Why I don't care about 'Climate Change' | David Saddington | TEDxTeen;TEDxNASA - Bruce Wielicki - Climate Change: Fact And Fiction;Why we are wrong when we think we are right | Chaehan So | TEDxMÃ Â¼nchen;Where in the world is it easiest to get rich? | Harald Eia | TEDxOslo;Africa, Stupid! | Marek ZmysÃ Â owski | TEDxKoszalin;Why the majority is always wrong | Paul Rulkens | TEDxMaastricht;The Skill of Humor | Andrew Tarvin | TEDxTAMU;Overpopulation facts - the problem no one will discuss: Alexandra Paul at TEDxTopanga;Why I live a zero waste life | Lauren Singer | TEDxTeen;What if you could trade a paperclip for a house? | Kyle MacDonald | TEDxVienna;The Discipline of Finishing: Conor Neill at TEDxUniversidaddeNavarra;Top hacker shows us how it's done | Pablos Holman | TEDxMidwest;The most important lesson from 83,000 brain scans | Daniel Amen | TEDxOrangeCoast;I Am Not Your Asian Stereotype | Canwen Xu | TEDxBoise;LetÃ¢Â Â s Talk Porn | Maria Ahlin | TEDxGÃ Â¶teborg;Mathematics is the sense you never knew you had | Eddie Woo | TEDxSydney	UCsT0YIqwnpJCM-mx7-gSA4Q;UCsT0YIqwnpJCM-mx7-gSA4Q;UCsT0YIqwnpJCM-mx7-gSA4Q;UCsT0YIqwnpJCM-mx7-gSA4Q;UCsT0YIqwnpJCM-mx7-gSA4Q;UCsT0YIqwnpJCM-mx7-gSA4Q;UCsT0YIqwnpJCM-mx7-gSA4Q;UCsT0YIqwnpJCM-mx7-gSA4Q;UCsT0YIqwnpJCM-mx7-gSA4Q;UCsT0YIqwnpJCM-mx7-gSA4Q;UCsT0YIqwnpJCM-mx7-gSA4Q;UCsT0YIqwnpJCM-mx7-gSA4Q;UCsT0YIqwnpJCM-mx7-gSA4Q;UCsT0YIqwnpJCM-mx7-gSA4Q;UCsT0YIqwnpJCM-mx7-gSA4Q;UCsT0YIqwnpJCM-mx7-gSA4Q;UCsT0YIqwnpJCM-mx7-gSA4Q;UCsT0YIqwnpJCM-mx7-gSA4Q;UCsT0YIqwnpJCM-mx7-gSA4Q;UCsT0YIqwnpJCM-mx7-gSA4Q	TEDx Talks;TEDx Talks;TEDx Talks;TEDx Talks;TEDx Talks;TEDx Talks;TEDx Talks;TEDx Talks;TEDx Talks;TEDx Talks;TEDx Talks;TEDx Talks;TEDx Talks;TEDx Talks;TEDx Talks;TEDx Talks;TEDx Talks;TEDx Talks;TEDx Talks;TEDx Talks	1020;888;356;1080;791;1020;818;900;811;686;1140;517;811;802;1380;1020;877;579;1020;793	1899710;5611095;9926864;2118565;494734;255961;113114;1738469;1571474;3767127;7391329;556482;3036281;10770457;3329581;22407509;12981178;2585748;1974421;924676	12;24;60;3;60;108;60;48;24;60;24;84;48;48;72;84;72;48;11;12	Why renewables canÃ¢Â Â t save the planet | Michael Shellenberger | TEDxDanubia by TEDx Talks 1 year ago 17 minutes 1,899,710 views;MEETING THE ENEMYÂ A feminist comes to terms with the Men's Rights movement | Cassie Jaye | TEDxMarin by TEDx Talks 2 years ago 14 minutes, 48 seconds 5,611,095 views;How to sound smart in your TEDx Talk | Will Stephen | TEDxNewYork by TEDx Talks 5 years ago 5 minutes, 56 seconds 9,926,864 views;Master Shi Heng Yi Ã¢Â Â 5 hindrances to self-mastery | Shi Heng YI | TEDxVitosha by TEDx Talks 3 months ago 18 minutes 2,118,565 views;Why I don't care about 'Climate Change' | David Saddington | TEDxTeen by TEDx Talks 5 years ago 13 minutes, 11 seconds 494,734 views;TEDxNASA - Bruce Wielicki - Climate Change: Fact And Fiction by TEDx Talks 9 years ago 17 minutes 255,961 views;Why we are wrong when we think we are right | Chaehan So | TEDxMÃ Â¼nchen by TEDx Talks 5 years ago 13 minutes, 38 seconds 113,114 views;Where in the world is it easiest to get rich? | Harald Eia | TEDxOslo by TEDx Talks 4 years ago 15 minutes 1,738,469 views;Africa, Stupid! | Marek ZmysÃ Â owski | TEDxKoszalin by TEDx Talks 2 years ago 13 minutes, 31 seconds 1,571,474 views;Why the majority is always wrong | Paul Rulkens | TEDxMaastricht by TEDx Talks 5 years ago 11 minutes, 26 seconds 3,767,127 views;The Skill of Humor | Andrew Tarvin | TEDxTAMU by TEDx Talks 2 years ago 19 minutes 7,391,329 views;Overpopulation facts - the problem no one will discuss: Alexandra Paul at TEDxTopanga by TEDx Talks 7 years ago 8 minutes, 37 seconds 556,482 views;Why I live a zero waste life | Lauren Singer | TEDxTeen by TEDx Talks 4 years ago 13 minutes, 31 seconds 3,036,281 views;What if you could trade a paperclip for a house? | Kyle MacDonald | TEDxVienna by TEDx Talks 4 years ago 13 minutes, 22 seconds 10,770,457 views;The Discipline of Finishing: Conor Neill at TEDxUniversidaddeNavarra by TEDx Talks 6 years ago 23 minutes 3,329,581 views;Top hacker shows us how it's done | Pablos Holman | TEDxMidwest by TEDx Talks 7 years ago 17 minutes 22,407,509 views;The most important lesson from 83,000 brain scans | Daniel Amen | TEDxOrangeCoast by TEDx Talks 6 years ago 14 minutes, 37 seconds 12,981,178 views;I Am Not Your Asian Stereotype | Canwen Xu | TEDxBoise by TEDx Talks 4 years ago 9 minutes, 39 seconds 2,585,748 views;LetÃ¢Â Â s Talk Porn | Maria Ahlin | TEDxGÃ Â¶teborg by TEDx Talks 11 months ago 17 minutes 1,974,421 views;Mathematics is the sense you never knew you had | Eddie Woo | TEDxSydney by TEDx Talks 1 year ago 13 minutes, 13 seconds 924,676 views
patrick moore	55	N-yALPEpV4w	https://www.youtube.com/watch?v=N-yALPEpV4w	Why renewables can t save the planet | Michael Shellenberger | TEDxDanubia	Environmentalists have long promoted renewable energy sources like solar panels and wind farms to save the climate. But what about when those technologies de...	TEDxTalks; English; Global Issues; Alternative energy; Climate Change; Energy; Environment; Global issues	https://i.ytimg.com/vi/N-yALPEpV4w/maxresdefault.jpg	video.other	False	UCsT0YIqwnpJCM-mx7-gSA4Q	PT17M33S	False	True	AD;AE;AF;AG;AI;AL;AM;AO;AQ;AR;AS;AT;AU;AW;AX;AZ;BA;BB;BD;BE;BF;BG;BH;BI;BJ;BL;BM;BN;BO;BQ;BR;BS;BT;BV;BW;BY;BZ;CA;CC;CD;CF;CG;CH;CI;CK;CL;CM;CN;CO;CR;CU;CV;CW;CX;CY;CZ;DE;DJ;DK;DM;DO;DZ;EC;EE;EG;EH;ER;ES;ET;FI;FJ;FK;FM;FO;FR;GA;GB;GD;GE;GF;GG;GH;GI;GL;GM;GN;GP;GQ;GR;GS;GT;GU;GW;GY;HK;HM;HN;HR;HT;HU;ID;IE;IL;IM;IN;IO;IQ;IR;IS;IT;JE;JM;JO;JP;KE;KG;KH;KI;KM;KN;KP;KR;KW;KY;KZ;LA;LB;LC;LI;LK;LR;LS;LT;LU;LV;LY;MA;MC;MD;ME;MF;MG;MH;MK;ML;MM;MN;MO;MP;MQ;MR;MS;MT;MU;MV;MW;MX;MY;MZ;NA;NC;NE;NF;NG;NI;NL;NO;NP;NR;NU;NZ;OM;PA;PE;PF;PG;PH;PK;PL;PM;PN;PR;PS;PT;PW;PY;QA;RE;RO;RS;RU;RW;SA;SB;SC;SD;SE;SG;SH;SI;SJ;SK;SL;SM;SN;SO;SR;SS;ST;SV;SX;SY;SZ;TC;TD;TF;TG;TH;TJ;TK;TL;TM;TN;TO;TR;TT;TV;TW;TZ;UA;UG;UM;US;UY;UZ;VA;VC;VE;VG;VI;VN;VU;WF;WS;YE;YT;ZA;ZM;ZW	1899710	2019-01-04	2019-01-04	Nonprofits & Activism	46733	5746	/watch?v=ciStnd9Y2ak	https://www.youtube.com/watch?v=/watch?v=ciStnd9Y2ak	ciStnd9Y2ak;VNGFep6rncY;kybenSq0KPo;3WMuzhQXJoY;8S0FDjFBj8o;vuIlsN32WaE;FbqnaoU-3VI;8s3bdVxuFBs;A9UmdY0E8hU;ljqra3BcqWM;M7hOpT0lPGI;0z03xkwFbw4;_VB39Jo8mAQ;wtV5ev6813I;ORp3q1Oaezw;_pUtz75lNaw;d0yGdNEWdn0;4-079YIasck;esPRsT-lmw8;2Yt6raj-S1M	https://www.youtube.com/watch?v=ciStnd9Y2ak;https://www.youtube.com/watch?v=VNGFep6rncY;https://www.youtube.com/watch?v=kybenSq0KPo;https://www.youtube.com/watch?v=3WMuzhQXJoY;https://www.youtube.com/watch?v=8S0FDjFBj8o;https://www.youtube.com/watch?v=vuIlsN32WaE;https://www.youtube.com/watch?v=FbqnaoU-3VI;https://www.youtube.com/watch?v=8s3bdVxuFBs;https://www.youtube.com/watch?v=A9UmdY0E8hU;https://www.youtube.com/watch?v=ljqra3BcqWM;https://www.youtube.com/watch?v=M7hOpT0lPGI;https://www.youtube.com/watch?v=0z03xkwFbw4;https://www.youtube.com/watch?v=_VB39Jo8mAQ;https://www.youtube.com/watch?v=wtV5ev6813I;https://www.youtube.com/watch?v=ORp3q1Oaezw;https://www.youtube.com/watch?v=_pUtz75lNaw;https://www.youtube.com/watch?v=d0yGdNEWdn0;https://www.youtube.com/watch?v=4-079YIasck;https://www.youtube.com/watch?v=esPRsT-lmw8;https://www.youtube.com/watch?v=2Yt6raj-S1M	Why I changed my mind about nuclear power | Michael Shellenberger | TEDxBerlin;Why the majority is always wrong | Paul Rulkens | TEDxMaastricht;Thorium can give humanity clean, pollution free energy | Kirk Sorensen | TEDxColoradoSprings;MEETING THE ENEMYÂ A feminist comes to terms with the Men's Rights movement | Cassie Jaye | TEDxMarin;How to sound smart in your TEDx Talk | Will Stephen | TEDxNewYork;The mathematics of weight loss | Ruben Meerman | TEDxQUT (edited version);Why is algebra so hard? | Emmanuel Schanzer | TEDxBeaconStreet;What if you could trade a paperclip for a house? | Kyle MacDonald | TEDxVienna;Where in the world is it easiest to get rich? | Harald Eia | TEDxOslo;Extreme Ownership | Jocko Willink | TEDxUniversityofNevada;I've studied nuclear war for 35 years -- you should be worried. | Brian Toon | TEDxMileHigh;What is the best diet for humans? | Eran Segal | TEDxRuppin;When money isnÃ¢Â Â t real: the $10,000 experiment | Adam Carroll | TEDxLondonBusinessSchool;Germany: Low Crime, Clean Prisons, Lessons for America | Jeff Rosen | TEDxMountainViewHighSchool;Why I, as a black man, attend KKK rallies. | Daryl Davis | TEDxNaperville;I Am Not Your Asian Stereotype | Canwen Xu | TEDxBoise;How to learn any language in six months | Chris Lonsdale | TEDxLingnanUniversity;Master Shi Heng Yi Ã¢Â Â 5 hindrances to self-mastery | Shi Heng YI | TEDxVitosha;The most important lesson from 83,000 brain scans | Daniel Amen | TEDxOrangeCoast;How School Makes Kids Less Intelligent | Eddy Zhong | TEDxYouth@BeaconStreet	UCsT0YIqwnpJCM-mx7-gSA4Q;UCsT0YIqwnpJCM-mx7-gSA4Q;UCsT0YIqwnpJCM-mx7-gSA4Q;UCsT0YIqwnpJCM-mx7-gSA4Q;UCsT0YIqwnpJCM-mx7-gSA4Q;UCsT0YIqwnpJCM-mx7-gSA4Q;UCsT0YIqwnpJCM-mx7-gSA4Q;UCsT0YIqwnpJCM-mx7-gSA4Q;UCsT0YIqwnpJCM-mx7-gSA4Q;UCsT0YIqwnpJCM-mx7-gSA4Q;UCsT0YIqwnpJCM-mx7-gSA4Q;UCsT0YIqwnpJCM-mx7-gSA4Q;UCsT0YIqwnpJCM-mx7-gSA4Q;UCsT0YIqwnpJCM-mx7-gSA4Q;UCsT0YIqwnpJCM-mx7-gSA4Q;UCsT0YIqwnpJCM-mx7-gSA4Q;UCsT0YIqwnpJCM-mx7-gSA4Q;UCsT0YIqwnpJCM-mx7-gSA4Q;UCsT0YIqwnpJCM-mx7-gSA4Q	TEDx Talks;TEDx Talks;TEDx Talks;TEDx Talks;TEDx Talks;TEDx Talks;TEDx Talks;TEDx Talks;TEDx Talks;TEDx Talks;TEDx Talks;TEDx Talks;TEDx Talks;TEDx Talks;TEDx Talks;TEDx Talks;TEDx Talks;TEDx Talks;TEDx Talks;TEDx Talks	1200;686;960;888;356;1260;832;802;900;830;899;1140;900;1500;1080;579;1080;1080;877;524	1166399;3767128;1159283;5611095;9926864;8890175;362216;10770457;1738469;3874429;3309666;2402227;5393144;1954357;6759771;2585748;21779743;2118565;12981178;4724235	24;60;60;24;60;72;36;48;48;36;420;36;48;36;24;48;72;3;72;60	Why I changed my mind about nuclear power | Michael Shellenberger | TEDxBerlin by TEDx Talks 2 years ago 20 minutes 1,166,399 views;Why the majority is always wrong | Paul Rulkens | TEDxMaastricht by TEDx Talks 5 years ago 11 minutes, 26 seconds 3,767,128 views;Thorium can give humanity clean, pollution free energy | Kirk Sorensen | TEDxColoradoSprings by TEDx Talks 5 years ago 16 minutes 1,159,283 views;MEETING THE ENEMYÂ A feminist comes to terms with the Men's Rights movement | Cassie Jaye | TEDxMarin by TEDx Talks 2 years ago 14 minutes, 48 seconds 5,611,095 views;How to sound smart in your TEDx Talk | Will Stephen | TEDxNewYork by TEDx Talks 5 years ago 5 minutes, 56 seconds 9,926,864 views;The mathematics of weight loss | Ruben Meerman | TEDxQUT (edited version) by TEDx Talks 6 years ago 21 minutes 8,890,175 views;Why is algebra so hard? | Emmanuel Schanzer | TEDxBeaconStreet by TEDx Talks 3 years ago 13 minutes, 52 seconds 362,216 views;What if you could trade a paperclip for a house? | Kyle MacDonald | TEDxVienna by TEDx Talks 4 years ago 13 minutes, 22 seconds 10,770,457 views;Where in the world is it easiest to get rich? | Harald Eia | TEDxOslo by TEDx Talks 4 years ago 15 minutes 1,738,469 views;Extreme Ownership | Jocko Willink | TEDxUniversityofNevada by TEDx Talks 3 years ago 13 minutes, 50 seconds 3,874,429 views;I've studied nuclear war for 35 years -- you should be worried. | Brian Toon | TEDxMileHigh by TEDx Talks 2 years ago 14 minutes, 59 seconds 3,309,666 views;What is the best diet for humans? | Eran Segal | TEDxRuppin by TEDx Talks 3 years ago 19 minutes 2,402,227 views;When money isnÃ¢Â Â t real: the $10,000 experiment | Adam Carroll | TEDxLondonBusinessSchool by TEDx Talks 4 years ago 15 minutes 5,393,144 views;Germany: Low Crime, Clean Prisons, Lessons for America | Jeff Rosen | TEDxMountainViewHighSchool by TEDx Talks 3 years ago 25 minutes 1,954,357 views;Why I, as a black man, attend KKK rallies. | Daryl Davis | TEDxNaperville by TEDx Talks 2 years ago 18 minutes 6,759,771 views;I Am Not Your Asian Stereotype | Canwen Xu | TEDxBoise by TEDx Talks 4 years ago 9 minutes, 39 seconds 2,585,748 views;How to learn any language in six months | Chris Lonsdale | TEDxLingnanUniversity by TEDx Talks 6 years ago 18 minutes 21,779,743 views;Master Shi Heng Yi Ã¢Â Â 5 hindrances to self-mastery | Shi Heng YI | TEDxVitosha by TEDx Talks 3 months ago 18 minutes 2,118,565 views;The most important lesson from 83,000 brain scans | Daniel Amen | TEDxOrangeCoast by TEDx Talks 6 years ago 14 minutes, 37 seconds 12,981,178 views;How School Makes Kids Less Intelligent | Eddy Zhong | TEDxYouth@BeaconStreet by TEDx Talks 5 years ago 8 minutes, 44 seconds 4,724,235 views
patrick moore	56	ciStnd9Y2ak	https://www.youtube.com/watch?v=ciStnd9Y2ak	Why I changed my mind about nuclear power | Michael Shellenberger | TEDxBerlin	For more information on Michael Shellenberger, please visit www.tedxberlin.de. Michael Shellenberger is co-founder and Senior Fellow at the Breakthrough Inst...	TEDxTalks; English; Education; Energy; Environment	https://i.ytimg.com/vi/ciStnd9Y2ak/maxresdefault.jpg	video.other	False	UCsT0YIqwnpJCM-mx7-gSA4Q	PT20M29S	False	True	AD;AE;AF;AG;AI;AL;AM;AO;AQ;AR;AS;AT;AU;AW;AX;AZ;BA;BB;BD;BE;BF;BG;BH;BI;BJ;BL;BM;BN;BO;BQ;BR;BS;BT;BV;BW;BY;BZ;CA;CC;CD;CF;CG;CH;CI;CK;CL;CM;CN;CO;CR;CU;CV;CW;CX;CY;CZ;DE;DJ;DK;DM;DO;DZ;EC;EE;EG;EH;ER;ES;ET;FI;FJ;FK;FM;FO;FR;GA;GB;GD;GE;GF;GG;GH;GI;GL;GM;GN;GP;GQ;GR;GS;GT;GU;GW;GY;HK;HM;HN;HR;HT;HU;ID;IE;IL;IM;IN;IO;IQ;IR;IS;IT;JE;JM;JO;JP;KE;KG;KH;KI;KM;KN;KP;KR;KW;KY;KZ;LA;LB;LC;LI;LK;LR;LS;LT;LU;LV;LY;MA;MC;MD;ME;MF;MG;MH;MK;ML;MM;MN;MO;MP;MQ;MR;MS;MT;MU;MV;MW;MX;MY;MZ;NA;NC;NE;NF;NG;NI;NL;NO;NP;NR;NU;NZ;OM;PA;PE;PF;PG;PH;PK;PL;PM;PN;PR;PS;PT;PW;PY;QA;RE;RO;RS;RU;RW;SA;SB;SC;SD;SE;SG;SH;SI;SJ;SK;SL;SM;SN;SO;SR;SS;ST;SV;SX;SY;SZ;TC;TD;TF;TG;TH;TJ;TK;TL;TM;TN;TO;TR;TT;TV;TW;TZ;UA;UG;UM;US;UY;UZ;VA;VC;VE;VG;VI;VN;VU;WF;WS;YE;YT;ZA;ZM;ZW	1166399	2017-11-17	2017-11-17	Nonprofits & Activism	33574	2205	/watch?v=2Yt6raj-S1M	https://www.youtube.com/watch?v=/watch?v=2Yt6raj-S1M	2Yt6raj-S1M;ORp3q1Oaezw;8s3bdVxuFBs;hqKafI7Amd8;vuIlsN32WaE;N2vzotsvvkw;A9UmdY0E8hU;VNGFep6rncY;9vJRopau0g0;kqrahBJkKAs;ljqra3BcqWM;e4PTvXtz4GM;u9hauSrihYQ;luvthTjC0OI;3WMuzhQXJoY;PXwStduNw14;btF6nKHo2i0;_pUtz75lNaw;M7hOpT0lPGI	https://www.youtube.com/watch?v=2Yt6raj-S1M;https://www.youtube.com/watch?v=ORp3q1Oaezw;https://www.youtube.com/watch?v=8s3bdVxuFBs;https://www.youtube.com/watch?v=hqKafI7Amd8;https://www.youtube.com/watch?v=vuIlsN32WaE;https://www.youtube.com/watch?v=N2vzotsvvkw;https://www.youtube.com/watch?v=A9UmdY0E8hU;https://www.youtube.com/watch?v=VNGFep6rncY;https://www.youtube.com/watch?v=9vJRopau0g0;https://www.youtube.com/watch?v=kqrahBJkKAs;https://www.youtube.com/watch?v=ljqra3BcqWM;https://www.youtube.com/watch?v=e4PTvXtz4GM;https://www.youtube.com/watch?v=u9hauSrihYQ;https://www.youtube.com/watch?v=luvthTjC0OI;https://www.youtube.com/watch?v=3WMuzhQXJoY;https://www.youtube.com/watch?v=PXwStduNw14;https://www.youtube.com/watch?v=btF6nKHo2i0;https://www.youtube.com/watch?v=_pUtz75lNaw;https://www.youtube.com/watch?v=M7hOpT0lPGI	How School Makes Kids Less Intelligent | Eddy Zhong | TEDxYouth@BeaconStreet;Mix - TEDx Talks;Why I, as a black man, attend KKK rallies. | Daryl Davis | TEDxNaperville;What if you could trade a paperclip for a house? | Kyle MacDonald | TEDxVienna;Top hacker shows us how it's done | Pablos Holman | TEDxMidwest;The mathematics of weight loss | Ruben Meerman | TEDxQUT (edited version);Thorium: Kirk Sorensen at TEDxYYC;Where in the world is it easiest to get rich? | Harald Eia | TEDxOslo;Why the majority is always wrong | Paul Rulkens | TEDxMaastricht;The Super Mario Effect - Tricking Your Brain into Learning More | Mark Rober | TEDxPenn;Space Exploration is the Worst | Emily Calandrelli | TEDxIndianaUniversity;Extreme Ownership | Jocko Willink | TEDxUniversityofNevada;Faster than a calculator | Arthur Benjamin | TEDxOxford;Why do we ask questions? Michael Vsauce Stevens at TEDxVienna;The Dark Net isn't what you think. It's actually key to our privacy | Alex Winter | TEDxMidAtlantic;MEETING THE ENEMYÂ A feminist comes to terms with the Men's Rights movement | Cassie Jaye | TEDxMarin;Mathematics is the sense you never knew you had | Eddie Woo | TEDxSydney;An Economic Hit Man Confesses and Calls to Action | John Perkins | TEDxTraverseCity;I Am Not Your Asian Stereotype | Canwen Xu | TEDxBoise;I've studied nuclear war for 35 years -- you should be worried. | Brian Toon | TEDxMileHigh	UCsT0YIqwnpJCM-mx7-gSA4Q;UCsT0YIqwnpJCM-mx7-gSA4Q;UCsT0YIqwnpJCM-mx7-gSA4Q;UCsT0YIqwnpJCM-mx7-gSA4Q;UCsT0YIqwnpJCM-mx7-gSA4Q;UCsT0YIqwnpJCM-mx7-gSA4Q;UCsT0YIqwnpJCM-mx7-gSA4Q;UCsT0YIqwnpJCM-mx7-gSA4Q;UCsT0YIqwnpJCM-mx7-gSA4Q;UCsT0YIqwnpJCM-mx7-gSA4Q;UCsT0YIqwnpJCM-mx7-gSA4Q;UCsT0YIqwnpJCM-mx7-gSA4Q;UCsT0YIqwnpJCM-mx7-gSA4Q;UCsT0YIqwnpJCM-mx7-gSA4Q;UCsT0YIqwnpJCM-mx7-gSA4Q;UCsT0YIqwnpJCM-mx7-gSA4Q;UCsT0YIqwnpJCM-mx7-gSA4Q;UCsT0YIqwnpJCM-mx7-gSA4Q	TEDx Talks;TEDx Talks;TEDx Talks;TEDx Talks;TEDx Talks;TEDx Talks;TEDx Talks;TEDx Talks;TEDx Talks;TEDx Talks;TEDx Talks;TEDx Talks;TEDx Talks;TEDx Talks;TEDx Talks;TEDx Talks;TEDx Talks;TEDx Talks;TEDx Talks	524;1080;802;1020;1260;603;900;686;900;877;830;900;1020;1020;888;793;1080;579;899	4724266;6759771;10770547;22407509;8890175;410735;1738469;3767128;4023234;703684;3874429;20675093;4712355;1586693;5611141;924676;511102;2585748;3309666	60;24;48;84;72;108;48;60;12;48;36;84;72;48;24;12;36;48;420	How School Makes Kids Less Intelligent | Eddy Zhong | TEDxYouth@BeaconStreet by TEDx Talks 5 years ago 8 minutes, 44 seconds 4,724,266 views;Why I, as a black man, attend KKK rallies. | Daryl Davis | TEDxNaperville by TEDx Talks 2 years ago 18 minutes 6,759,771 views;What if you could trade a paperclip for a house? | Kyle MacDonald | TEDxVienna by TEDx Talks 4 years ago 13 minutes, 22 seconds 10,770,547 views;Top hacker shows us how it's done | Pablos Holman | TEDxMidwest by TEDx Talks 7 years ago 17 minutes 22,407,509 views;The mathematics of weight loss | Ruben Meerman | TEDxQUT (edited version) by TEDx Talks 6 years ago 21 minutes 8,890,175 views;Thorium: Kirk Sorensen at TEDxYYC by TEDx Talks 9 years ago 10 minutes, 3 seconds 410,735 views;Where in the world is it easiest to get rich? | Harald Eia | TEDxOslo by TEDx Talks 4 years ago 15 minutes 1,738,469 views;Why the majority is always wrong | Paul Rulkens | TEDxMaastricht by TEDx Talks 5 years ago 11 minutes, 26 seconds 3,767,128 views;The Super Mario Effect - Tricking Your Brain into Learning More | Mark Rober | TEDxPenn by TEDx Talks 1 year ago 15 minutes 4,023,234 views;Space Exploration is the Worst | Emily Calandrelli | TEDxIndianaUniversity by TEDx Talks 4 years ago 14 minutes, 37 seconds 703,684 views;Extreme Ownership | Jocko Willink | TEDxUniversityofNevada by TEDx Talks 3 years ago 13 minutes, 50 seconds 3,874,429 views;Faster than a calculator | Arthur Benjamin | TEDxOxford by TEDx Talks 7 years ago 15 minutes 20,675,093 views;Why do we ask questions? Michael Vsauce Stevens at TEDxVienna by TEDx Talks 6 years ago 17 minutes 4,712,355 views;The Dark Net isn't what you think. It's actually key to our privacy | Alex Winter | TEDxMidAtlantic by TEDx Talks 4 years ago 17 minutes 1,586,693 views;MEETING THE ENEMYÂ A feminist comes to terms with the Men's Rights movement | Cassie Jaye | TEDxMarin by TEDx Talks 2 years ago 14 minutes, 48 seconds 5,611,141 views;Mathematics is the sense you never knew you had | Eddie Woo | TEDxSydney by TEDx Talks 1 year ago 13 minutes, 13 seconds 924,676 views;An Economic Hit Man Confesses and Calls to Action | John Perkins | TEDxTraverseCity by TEDx Talks 3 years ago 18 minutes 511,102 views;I Am Not Your Asian Stereotype | Canwen Xu | TEDxBoise by TEDx Talks 4 years ago 9 minutes, 39 seconds 2,585,748 views;I've studied nuclear war for 35 years -- you should be worried. | Brian Toon | TEDxMileHigh by TEDx Talks 2 years ago 14 minutes, 59 seconds 3,309,666 views
