keyword_ref	iteration	video_id	url	title	description	keywords	image	type	paid	channel_id	duration	unlisted	family	regions	views	date_publication	date_upload	genre	like	dislike	next_video_id	next_video_url	reco_videos_id	reco_urls	reco_titles	reco_channels_id	reco_channels_name	reco_durations	reco_views	reco_ages_month	reco_snippets
global warming	8	B-nEYsyRlYo	https://www.youtube.com/watch?v=B-nEYsyRlYo	His Epic Message Will Make You Want to Save the World | Short Film Showcase	As the human population continues to grow, so does our impact on the environment. In fact, recent research has shown that three-quarters of Earth s land surf...	word artist; prince ea; planet; earth; challenge; human; epic; message; PLivjPDlt6ApRiBHpsyXWG22G8RPNZ6jlb; PLivjPDlt6ApTjurXykShuUqp7LQcj9s8s; PLivjPDlt6ApT...	https://i.ytimg.com/vi/B-nEYsyRlYo/maxresdefault.jpg	video.other	False	UCpVm7bg6pXKo1Pr6k5kxG9A	PT4M24S	False	True	AD;AE;AF;AG;AI;AL;AM;AO;AQ;AR;AS;AT;AU;AW;AX;AZ;BA;BB;BD;BE;BF;BG;BH;BI;BJ;BL;BM;BN;BO;BQ;BR;BS;BT;BV;BW;BY;BZ;CA;CC;CD;CF;CG;CH;CI;CK;CL;CM;CN;CO;CR;CU;CV;CW;CX;CY;CZ;DE;DJ;DK;DM;DO;DZ;EC;EE;EG;EH;ER;ES;ET;FI;FJ;FK;FM;FO;FR;GA;GB;GD;GE;GF;GG;GH;GI;GL;GM;GN;GP;GQ;GR;GS;GT;GU;GW;GY;HK;HM;HN;HR;HT;HU;ID;IE;IL;IM;IN;IO;IQ;IR;IS;IT;JE;JM;JO;JP;KE;KG;KH;KI;KM;KN;KP;KR;KW;KY;KZ;LA;LB;LC;LI;LK;LR;LS;LT;LU;LV;LY;MA;MC;MD;ME;MF;MG;MH;MK;ML;MM;MN;MO;MP;MQ;MR;MS;MT;MU;MV;MW;MX;MY;MZ;NA;NC;NE;NF;NG;NI;NL;NO;NP;NR;NU;NZ;OM;PA;PE;PF;PG;PH;PK;PL;PM;PN;PR;PS;PT;PW;PY;QA;RE;RO;RS;RU;RW;SA;SB;SC;SD;SE;SG;SH;SI;SJ;SK;SL;SM;SN;SO;SR;SS;ST;SV;SX;SY;SZ;TC;TD;TF;TG;TH;TJ;TK;TL;TM;TN;TO;TR;TT;TV;TW;TZ;UA;UG;UM;US;UY;UZ;VA;VC;VE;VG;VI;VN;VU;WF;WS;YE;YT;ZA;ZM;ZW	1472263	2017-01-10	2017-01-10	Entertainment	115218	1726	/watch?v=WmVLcj-XKnM	https://www.youtube.com/watch?v=/watch?v=WmVLcj-XKnM	WmVLcj-XKnM;eRLJscAlk1M;0Puv0Pss33M;BXyfCGDnuWs;ZyYqyYAKGC0;_6xlNyWPpB8;_ICREZm9CtE;uD4izuDMUQA;HQTUWK7CM-Y;Ok8rMT2KCy0;3FDL4ZYEfcw;7uiv6tKtoKg;RS7IzU2VJIQ;Yomf5pBN8dY;dGiQaabX3_o;a0FUsy5pqa4;M2NDQOgGycg;DkZ7BJQupVA;pF72px2R3Hg;mRUoLarLLVA	https://www.youtube.com/watch?v=WmVLcj-XKnM;https://www.youtube.com/watch?v=eRLJscAlk1M;https://www.youtube.com/watch?v=0Puv0Pss33M;https://www.youtube.com/watch?v=BXyfCGDnuWs;https://www.youtube.com/watch?v=ZyYqyYAKGC0;https://www.youtube.com/watch?v=_6xlNyWPpB8;https://www.youtube.com/watch?v=_ICREZm9CtE;https://www.youtube.com/watch?v=uD4izuDMUQA;https://www.youtube.com/watch?v=HQTUWK7CM-Y;https://www.youtube.com/watch?v=Ok8rMT2KCy0;https://www.youtube.com/watch?v=3FDL4ZYEfcw;https://www.youtube.com/watch?v=7uiv6tKtoKg;https://www.youtube.com/watch?v=RS7IzU2VJIQ;https://www.youtube.com/watch?v=Yomf5pBN8dY;https://www.youtube.com/watch?v=dGiQaabX3_o;https://www.youtube.com/watch?v=a0FUsy5pqa4;https://www.youtube.com/watch?v=M2NDQOgGycg;https://www.youtube.com/watch?v=DkZ7BJQupVA;https://www.youtube.com/watch?v=pF72px2R3Hg;https://www.youtube.com/watch?v=mRUoLarLLVA	Nature Is Speaking Ã¢Â Â Julia Roberts is Mother Nature | Conservation International (CI);Dear Future Generations: Sorry;How to Save Our Planet;109-Year-Old Veteran and His Secrets to Life Will Make You Smile | Short Film Showcase;Time Is But a Stubborn Illusion - Sneak Peek | Genius;What really happens to the plastic you throw away - Emma Bryce;BEFORE YOU OVERTHINK, WATCH THIS;TIMELAPSE OF THE FUTURE: A Journey to the End of Time (4K);How We Can Keep Plastics Out of Our Ocean | National Geographic;Climate Change: ItÃ¢Â Â s Real. ItÃ¢Â Â s Serious. And itÃ¢Â Â s up to us to Solve it. | National Geographic;36,000 Kids You DonÃ¢Â Â t Want to Mess With | Short Film Showcase;What Will We Miss?;Plastic Pollution: How Humans are Turning the World into Plastic;POWERFUL VIDEO: Why We Need to Stop Plastic Pollution in Our Oceans FOR GOOD | Oceana;What Happened Before History? Human Origins;What Would You Do If Money DidnÃ¢Â Â t Matter? | Short Film Showcase;STOP wasting your life (2020);Why humans are so bad at thinking about climate change;Why I live a zero waste life | Lauren Singer | TEDxTeen;Will This Be Humanity's Fate?	UCam5sCp6mzGBcn8ZBB2RBJg;UCDgUAAHgsV2fFZQm2fIWBnA;UC5MDIy3yhWDrx0MyDo4QmYg;UCpVm7bg6pXKo1Pr6k5kxG9A;UCpVm7bg6pXKo1Pr6k5kxG9A;UCsooa4yRKGN_zEE8iknghZA;UCDgUAAHgsV2fFZQm2fIWBnA;UCR9sFzaG9Ia_kXJhfxtFMBA;UCpVm7bg6pXKo1Pr6k5kxG9A;UCpVm7bg6pXKo1Pr6k5kxG9A;UCpVm7bg6pXKo1Pr6k5kxG9A;UC6nSFpj9HTCZ5t-N3Rm3-HA;UCsXVk37bltHxD1rDPwtNM8Q;UCfGiG69KkK0rzX9HYwJMbsw;UCsXVk37bltHxD1rDPwtNM8Q;UCpVm7bg6pXKo1Pr6k5kxG9A;UCDgUAAHgsV2fFZQm2fIWBnA;UCLXo7UDZvByw2ixzpQCufnA;UCsT0YIqwnpJCM-mx7-gSA4Q;UCDgUAAHgsV2fFZQm2fIWBnA	Conservation International;Prince Ea;WWF International;National Geographic;National Geographic;TED-Ed;Prince Ea;melodysheep;National Geographic;National Geographic;National Geographic;Vsauce;Kurzgesagt Ã¢Â Â In a Nutshell;Oceana;Kurzgesagt Ã¢Â Â In a Nutshell;National Geographic;Prince Ea;Vox;TEDx Talks;Prince Ea	119;363;508;759;274;247;253;1740;191;117;206;589;542;276;606;184;427;585;811;272	10664484;23936109;889029;26570756;5983637;2921457;12112388;35036515;1765640;281364;9523027;23130669;5525181;159319;14493789;183890;10146273;1774534;3036173;1442282	60;60;12;36;36;60;12;12;36;48;48;72;12;7;36;48;11;36;48;24	Nature Is Speaking Ã¢Â Â Julia Roberts is Mother Nature | Conservation International (CI) by Conservation International 5 years ago 119 seconds 10,664,484 views;Dear Future Generations: Sorry by Prince Ea 5 years ago 6 minutes, 3 seconds 23,936,109 views;How to Save Our Planet by WWF International 1 year ago 8 minutes, 28 seconds 889,029 views;109-Year-Old Veteran and His Secrets to Life Will Make You Smile | Short Film Showcase by National Geographic 3 years ago 12 minutes, 39 seconds 26,570,756 views;Time Is But a Stubborn Illusion - Sneak Peek | Genius by National Geographic 3 years ago 4 minutes, 34 seconds 5,983,637 views;What really happens to the plastic you throw away - Emma Bryce by TED-Ed 5 years ago 4 minutes, 7 seconds 2,921,457 views;BEFORE YOU OVERTHINK, WATCH THIS by Prince Ea 1 year ago 4 minutes, 13 seconds 12,112,388 views;TIMELAPSE OF THE FUTURE: A Journey to the End of Time (4K) by melodysheep 1 year ago 29 minutes 35,036,515 views;How We Can Keep Plastics Out of Our Ocean | National Geographic by National Geographic 3 years ago 3 minutes, 11 seconds 1,765,640 views;Climate Change: ItÃ¢Â Â s Real. ItÃ¢Â Â s Serious. And itÃ¢Â Â s up to us to Solve it. | National Geographic by National Geographic 4 years ago 117 seconds 281,364 views;36,000 Kids You DonÃ¢Â Â t Want to Mess With | Short Film Showcase by National Geographic 4 years ago 3 minutes, 26 seconds 9,523,027 views;What Will We Miss? by Vsauce 6 years ago 9 minutes, 49 seconds 23,130,669 views;Plastic Pollution: How Humans are Turning the World into Plastic by Kurzgesagt Ã¢Â Â In a Nutshell 1 year ago 9 minutes, 2 seconds 5,525,181 views;POWERFUL VIDEO: Why We Need to Stop Plastic Pollution in Our Oceans FOR GOOD | Oceana by Oceana 7 months ago 4 minutes, 36 seconds 159,319 views;What Happened Before History? Human Origins by Kurzgesagt Ã¢Â Â In a Nutshell 3 years ago 10 minutes, 6 seconds 14,493,789 views;What Would You Do If Money DidnÃ¢Â Â t Matter? | Short Film Showcase by National Geographic 4 years ago 3 minutes, 4 seconds 183,890 views;STOP wasting your life (2020) by Prince Ea 11 months ago 7 minutes, 7 seconds 10,146,273 views;Why humans are so bad at thinking about climate change by Vox 3 years ago 9 minutes, 45 seconds 1,774,534 views;Why I live a zero waste life | Lauren Singer | TEDxTeen by TEDx Talks 4 years ago 13 minutes, 31 seconds 3,036,173 views;Will This Be Humanity's Fate? by Prince Ea 2 years ago 4 minutes, 32 seconds 1,442,282 views
global temperature	41	oJAbATJCugs	https://www.youtube.com/watch?v=oJAbATJCugs	Global Warming 101 | National Geographic	Global warming could do more than just melt polar ice. It could change our maps, and displace people from cities and tropical islands. See all National Geogr...	101; national geographic; nat geo; natgeo; animals; wildlife; science; explore; discover; survival; nature; culture; documentary; 101 series; world lessons; ...	https://i.ytimg.com/vi/oJAbATJCugs/maxresdefault.jpg	video.other	False	UCpVm7bg6pXKo1Pr6k5kxG9A	PT3M4S	False	True	AD;AE;AF;AG;AI;AL;AM;AO;AQ;AR;AS;AT;AU;AW;AX;AZ;BA;BB;BD;BE;BF;BG;BH;BI;BJ;BL;BM;BN;BO;BQ;BR;BS;BT;BV;BW;BY;BZ;CA;CC;CD;CF;CG;CH;CI;CK;CL;CM;CN;CO;CR;CU;CV;CW;CX;CY;CZ;DE;DJ;DK;DM;DO;DZ;EC;EE;EG;EH;ER;ES;ET;FI;FJ;FK;FM;FO;FR;GA;GB;GD;GE;GF;GG;GH;GI;GL;GM;GN;GP;GQ;GR;GS;GT;GU;GW;GY;HK;HM;HN;HR;HT;HU;ID;IE;IL;IM;IN;IO;IQ;IR;IS;IT;JE;JM;JO;JP;KE;KG;KH;KI;KM;KN;KP;KR;KW;KY;KZ;LA;LB;LC;LI;LK;LR;LS;LT;LU;LV;LY;MA;MC;MD;ME;MF;MG;MH;MK;ML;MM;MN;MO;MP;MQ;MR;MS;MT;MU;MV;MW;MX;MY;MZ;NA;NC;NE;NF;NG;NI;NL;NO;NP;NR;NU;NZ;OM;PA;PE;PF;PG;PH;PK;PL;PM;PN;PR;PS;PT;PW;PY;QA;RE;RO;RS;RU;RW;SA;SB;SC;SD;SE;SG;SH;SI;SJ;SK;SL;SM;SN;SO;SR;SS;ST;SV;SX;SY;SZ;TC;TD;TF;TG;TH;TJ;TK;TL;TM;TN;TO;TR;TT;TV;TW;TZ;UA;UG;UM;US;UY;UZ;VA;VC;VE;VG;VI;VN;VU;WF;WS;YE;YT;ZA;ZM;ZW	3986217	2007-05-18	2007-05-18	Entertainment	14281	2502	/watch?v=Ok8rMT2KCy0	https://www.youtube.com/watch?v=/watch?v=Ok8rMT2KCy0	Ok8rMT2KCy0;0Puv0Pss33M;aU6pxSNDPhs;_6xlNyWPpB8;b6CPsGanO_U;1PDjVDIrFec;DkZ7BJQupVA;RS7IzU2VJIQ;o0W_0MuvlwQ;hOFRbjjjwCE;HQTUWK7CM-Y;b6Ua_zWDH6U;McRYTC56DC4;x7KKkElpyKQ;e6rglsLy1Ys;EZSCtgfmEO0;ffjIyms1BX4;MYnjzsjeMK8;zRQvxLuvtX0;dcBXmj1nMTQ	https://www.youtube.com/watch?v=Ok8rMT2KCy0;https://www.youtube.com/watch?v=0Puv0Pss33M;https://www.youtube.com/watch?v=aU6pxSNDPhs;https://www.youtube.com/watch?v=_6xlNyWPpB8;https://www.youtube.com/watch?v=b6CPsGanO_U;https://www.youtube.com/watch?v=1PDjVDIrFec;https://www.youtube.com/watch?v=DkZ7BJQupVA;https://www.youtube.com/watch?v=RS7IzU2VJIQ;https://www.youtube.com/watch?v=o0W_0MuvlwQ;https://www.youtube.com/watch?v=hOFRbjjjwCE;https://www.youtube.com/watch?v=HQTUWK7CM-Y;https://www.youtube.com/watch?v=b6Ua_zWDH6U;https://www.youtube.com/watch?v=McRYTC56DC4;https://www.youtube.com/watch?v=x7KKkElpyKQ;https://www.youtube.com/watch?v=e6rglsLy1Ys;https://www.youtube.com/watch?v=EZSCtgfmEO0;https://www.youtube.com/watch?v=ffjIyms1BX4;https://www.youtube.com/watch?v=MYnjzsjeMK8;https://www.youtube.com/watch?v=zRQvxLuvtX0;https://www.youtube.com/watch?v=dcBXmj1nMTQ	Climate Change: ItÃ¢Â Â s Real. ItÃ¢Â Â s Serious. And itÃ¢Â Â s up to us to Solve it. | National Geographic;How to Save Our Planet;Climate 101: Ozone Depletion | National Geographic;What really happens to the plastic you throw away - Emma Bryce;What If All The Ice Melted On Earth? ft. Bill Nye;What is Acid Rain? | National Geographic;Why humans are so bad at thinking about climate change;Plastic Pollution: How Humans are Turning the World into Plastic;Caffeine 101 | National Geographic;These Are the Events That Will Happen Before 2050;How We Can Keep Plastics Out of Our Ocean | National Geographic;What is Biodiversity?;A Brief History of Global Warming;Which is better: Soap or hand sanitizer? - Alex Rosenthal and Pall Thordarson;Air Pollution 101 | National Geographic;NASA's plan to save Earth from a giant asteroid;Climate Science: What You Need To Know;Why Flat Earthers Are Dead Wrong;Climate change: what to expect and are there really two sides? | Ask Bob;What is Climate Change? | Start Here	UCpVm7bg6pXKo1Pr6k5kxG9A;UCpVm7bg6pXKo1Pr6k5kxG9A;UCsooa4yRKGN_zEE8iknghZA;UCC552Sd-3nyi_tk2BudLUzA;UCpVm7bg6pXKo1Pr6k5kxG9A;UCLXo7UDZvByw2ixzpQCufnA;UCsXVk37bltHxD1rDPwtNM8Q;UCpVm7bg6pXKo1Pr6k5kxG9A;UCP5tjEmvPItGyLhmjdwP7Ww;UCpVm7bg6pXKo1Pr6k5kxG9A;UC5MDIy3yhWDrx0MyDo4QmYg;UCUMZ7gohGI9HcU9VNsr2FJQ;UCsooa4yRKGN_zEE8iknghZA;UCpVm7bg6pXKo1Pr6k5kxG9A;UCLXo7UDZvByw2ixzpQCufnA;UCH4BNI0-FOK2dMXoFtViWHw;UCfdNM3NAhaBOXCafH7krzrA;UCKjU3KzdbJE1EFcHVqXC3_g;UCNye-wNBqNL5ZzHSJj3l8Bg	National Geographic;WWF International;National Geographic;TED-Ed;AsapSCIENCE;National Geographic;Vox;Kurzgesagt Ã¢Â Â In a Nutshell;National Geographic;RealLifeLore;National Geographic;WWF International;Bloomberg;TED-Ed;National Geographic;Vox;It's Okay To Be Smart;The Infographics Show;CBC News: The National;Al Jazeera English	117;508;206;247;351;119;585;542;175;564;191;185;197;375;233;389;380;657;1140;427	281364;889080;751352;2921721;6834366;682619;1774544;5525498;876895;20705398;1765708;114399;239709;885672;905492;6814745;1009074;2427623;312998;170302	48;12;24;60;36;24;36;12;12;24;36;12;48;0;24;24;60;4;24;5	Climate Change: ItÃ¢Â Â s Real. ItÃ¢Â Â s Serious. And itÃ¢Â Â s up to us to Solve it. | National Geographic by National Geographic 4 years ago 117 seconds 281,364 views;How to Save Our Planet by WWF International 1 year ago 8 minutes, 28 seconds 889,080 views;Climate 101: Ozone Depletion | National Geographic by National Geographic 2 years ago 3 minutes, 26 seconds 751,352 views;What really happens to the plastic you throw away - Emma Bryce by TED-Ed 5 years ago 4 minutes, 7 seconds 2,921,721 views;What If All The Ice Melted On Earth? ft. Bill Nye by AsapSCIENCE 3 years ago 5 minutes, 51 seconds 6,834,366 views;What is Acid Rain? | National Geographic by National Geographic 2 years ago 119 seconds 682,619 views;Why humans are so bad at thinking about climate change by Vox 3 years ago 9 minutes, 45 seconds 1,774,544 views;Plastic Pollution: How Humans are Turning the World into Plastic by Kurzgesagt Ã¢Â Â In a Nutshell 1 year ago 9 minutes, 2 seconds 5,525,498 views;Caffeine 101 | National Geographic by National Geographic 1 year ago 2 minutes, 55 seconds 876,895 views;These Are the Events That Will Happen Before 2050 by RealLifeLore 2 years ago 9 minutes, 24 seconds 20,705,398 views;How We Can Keep Plastics Out of Our Ocean | National Geographic by National Geographic 3 years ago 3 minutes, 11 seconds 1,765,708 views;What is Biodiversity? by WWF International 1 year ago 3 minutes, 5 seconds 114,399 views;A Brief History of Global Warming by Bloomberg 4 years ago 3 minutes, 17 seconds 239,709 views;Which is better: Soap or hand sanitizer? - Alex Rosenthal and Pall Thordarson by TED-Ed 2 weeks ago 6 minutes, 15 seconds 885,672 views;Air Pollution 101 | National Geographic by National Geographic 2 years ago 3 minutes, 53 seconds 905,492 views;NASA's plan to save Earth from a giant asteroid by Vox 2 years ago 6 minutes, 29 seconds 6,814,745 views;Climate Science: What You Need To Know by It's Okay To Be Smart 5 years ago 6 minutes, 20 seconds 1,009,074 views;Why Flat Earthers Are Dead Wrong by The Infographics Show 4 months ago 10 minutes, 57 seconds 2,427,623 views;Climate change: what to expect and are there really two sides? | Ask Bob by CBC News: The National 2 years ago 19 minutes 312,998 views;What is Climate Change? | Start Here by Al Jazeera English 5 months ago 7 minutes, 7 seconds 170,302 views
global temperature	42	Ok8rMT2KCy0	https://www.youtube.com/watch?v=Ok8rMT2KCy0	Geniet van je favoriete video's en muziek, upload originele content en deel alles met vrienden, familie en anderen op YouTube.	video; delen; cameratelefoon; videotelefoon; vrij; uploaden	https://i.ytimg.com/vi/Ok8rMT2KCy0/maxresdefault.jpg	video.other	NA	NA	/watch?v=eHMLszamZ9w	https://www.youtube.com/watch?v=/watch?v=eHMLszamZ9w	eHMLszamZ9w;Sv7OHfpIRfU;ZSt9tm3RoUU;WmVLcj-XKnM;ZyYqyYAKGC0;Yomf5pBN8dY;aU6pxSNDPhs;BxhxZHqHDGA;ztWHqUFJRTs;DkZ7BJQupVA;WJgpDyP9ewQ;HQTUWK7CM-Y;0Puv0Pss33M;_6xlNyWPpB8;e6rglsLy1Ys;o0W_0MuvlwQ;dGiQaabX3_o;G4H1N_yXBiA;-n4A0BssFd0;EbjKcHPmxKQ	https://www.youtube.com/watch?v=eHMLszamZ9w;https://www.youtube.com/watch?v=Sv7OHfpIRfU;https://www.youtube.com/watch?v=ZSt9tm3RoUU;https://www.youtube.com/watch?v=WmVLcj-XKnM;https://www.youtube.com/watch?v=ZyYqyYAKGC0;https://www.youtube.com/watch?v=Yomf5pBN8dY;https://www.youtube.com/watch?v=aU6pxSNDPhs;https://www.youtube.com/watch?v=BxhxZHqHDGA;https://www.youtube.com/watch?v=ztWHqUFJRTs;https://www.youtube.com/watch?v=DkZ7BJQupVA;https://www.youtube.com/watch?v=WJgpDyP9ewQ;https://www.youtube.com/watch?v=HQTUWK7CM-Y;https://www.youtube.com/watch?v=0Puv0Pss33M;https://www.youtube.com/watch?v=_6xlNyWPpB8;https://www.youtube.com/watch?v=e6rglsLy1Ys;https://www.youtube.com/watch?v=o0W_0MuvlwQ;https://www.youtube.com/watch?v=dGiQaabX3_o;https://www.youtube.com/watch?v=G4H1N_yXBiA;https://www.youtube.com/watch?v=-n4A0BssFd0;https://www.youtube.com/watch?v=EbjKcHPmxKQ	What is climate change?;Climate change (according to a kid);Our Story in 1 Minute;Nature Is Speaking Ã¢Â Â Julia Roberts is Mother Nature | Conservation International (CI);Time Is But a Stubborn Illusion - Sneak Peek | Genius;POWERFUL VIDEO: Why We Need to Stop Plastic Pollution in Our Oceans FOR GOOD | Oceana;Climate 101: Ozone Depletion | National Geographic;Visit an Immense, Real-Life Fairy-Tale Castle | National Geographic;Climate change: Earth's giant game of Tetris - Joss Fong;Why humans are so bad at thinking about climate change;Climate 101: Glaciers | National Geographic;How We Can Keep Plastics Out of Our Ocean | National Geographic;How to Save Our Planet;What really happens to the plastic you throw away - Emma Bryce;Air Pollution 101 | National Geographic;Caffeine 101 | National Geographic;What Happened Before History? Human Origins;Causes and Effects of Climate Change | National Geographic;Climate change explained in under 2 minutes;What people get wrong about climate change	UCaEEm-0s0x3MHg9jzFcHuQQ;UCdnZdQxYXnbN4uWJg96oGxw;UCR9sFzaG9Ia_kXJhfxtFMBA;UCam5sCp6mzGBcn8ZBB2RBJg;UCpVm7bg6pXKo1Pr6k5kxG9A;UCfGiG69KkK0rzX9HYwJMbsw;UCpVm7bg6pXKo1Pr6k5kxG9A;UCsooa4yRKGN_zEE8iknghZA;UCLXo7UDZvByw2ixzpQCufnA;UCpVm7bg6pXKo1Pr6k5kxG9A;UCpVm7bg6pXKo1Pr6k5kxG9A;UC5MDIy3yhWDrx0MyDo4QmYg;UCsooa4yRKGN_zEE8iknghZA;UCpVm7bg6pXKo1Pr6k5kxG9A;UCpVm7bg6pXKo1Pr6k5kxG9A;UCsXVk37bltHxD1rDPwtNM8Q;UCpVm7bg6pXKo1Pr6k5kxG9A;UCR2Ygp2qtlfHnzTrIF2HihQ;UCLXo7UDZvByw2ixzpQCufnA	Siemens;Rappler;melodysheep;Conservation International;National Geographic;Oceana;National Geographic;National Geographic;TED-Ed;Vox;National Geographic;National Geographic;WWF International;TED-Ed;National Geographic;National Geographic;Kurzgesagt Ã¢Â Â In a Nutshell;National Geographic;Climate-KIC;Vox	124;132;97;119;274;276;206;107;169;585;246;191;508;247;233;175;606;185;215;173	194757;685838;7701342;10664599;5983850;159450;751352;98969;638992;1774544;243765;1765708;889080;2921721;905492;876895;14494315;1715810;40123;833258	24;48;84;60;36;7;24;24;72;36;24;36;12;60;24;12;36;24;48;48	What is climate change? by Siemens 2 years ago 2 minutes, 4 seconds 194,757 views;Climate change (according to a kid) by Rappler 4 years ago 2 minutes, 12 seconds 685,838 views;Our Story in 1 Minute by melodysheep 7 years ago 97 seconds 7,701,342 views;Nature Is Speaking Ã¢Â Â Julia Roberts is Mother Nature | Conservation International (CI) by Conservation International 5 years ago 119 seconds 10,664,599 views;Time Is But a Stubborn Illusion - Sneak Peek | Genius by National Geographic 3 years ago 4 minutes, 34 seconds 5,983,850 views;POWERFUL VIDEO: Why We Need to Stop Plastic Pollution in Our Oceans FOR GOOD | Oceana by Oceana 7 months ago 4 minutes, 36 seconds 159,450 views;Climate 101: Ozone Depletion | National Geographic by National Geographic 2 years ago 3 minutes, 26 seconds 751,352 views;Visit an Immense, Real-Life Fairy-Tale Castle | National Geographic by National Geographic 2 years ago 107 seconds 98,969 views;Climate change: Earth's giant game of Tetris - Joss Fong by TED-Ed 6 years ago 2 minutes, 49 seconds 638,992 views;Why humans are so bad at thinking about climate change by Vox 3 years ago 9 minutes, 45 seconds 1,774,544 views;Climate 101: Glaciers | National Geographic by National Geographic 2 years ago 4 minutes, 6 seconds 243,765 views;How We Can Keep Plastics Out of Our Ocean | National Geographic by National Geographic 3 years ago 3 minutes, 11 seconds 1,765,708 views;How to Save Our Planet by WWF International 1 year ago 8 minutes, 28 seconds 889,080 views;What really happens to the plastic you throw away - Emma Bryce by TED-Ed 5 years ago 4 minutes, 7 seconds 2,921,721 views;Air Pollution 101 | National Geographic by National Geographic 2 years ago 3 minutes, 53 seconds 905,492 views;Caffeine 101 | National Geographic by National Geographic 1 year ago 2 minutes, 55 seconds 876,895 views;What Happened Before History? Human Origins by Kurzgesagt Ã¢Â Â In a Nutshell 3 years ago 10 minutes, 6 seconds 14,494,315 views;Causes and Effects of Climate Change | National Geographic by National Geographic 2 years ago 3 minutes, 5 seconds 1,715,810 views;Climate change explained in under 2 minutes by Climate-KIC 4 years ago 95 seconds 40,123 views;What people get wrong about climate change by Vox 4 years ago 2 minutes, 53 seconds 833,258 views											
