keyword_ref	iteration	video_id	url	title	description	keywords	image	type	paid	channel_id	duration	unlisted	family	regions	views	date_publication	date_upload	genre	like	dislike	next_video_id	next_video_url	reco_videos_id	reco_urls	reco_titles	reco_channels_id	reco_channels_name	reco_durations	reco_views	reco_ages_month	reco_snippets
climate science	47	-qfI3DZmmQw	https://www.youtube.com/watch?v=-qfI3DZmmQw	Scientists really aren t the best champions of climate science	Facts and data alone won t inspire people to take action in the fight against global warming. So what will? This is the sixth episode of Climate Lab, a six-p...	vox.com; vox; explain; climate lab; university of california; climate change; science; environment; environmental science; global warming; pope; debbie dooley	https://i.ytimg.com/vi/-qfI3DZmmQw/maxresdefault.jpg	video.other	False	UCLXo7UDZvByw2ixzpQCufnA	PT8M15S	False	True	AD;AE;AF;AG;AI;AL;AM;AO;AQ;AR;AS;AT;AU;AW;AX;AZ;BA;BB;BD;BE;BF;BG;BH;BI;BJ;BL;BM;BN;BO;BQ;BR;BS;BT;BV;BW;BY;BZ;CA;CC;CD;CF;CG;CH;CI;CK;CL;CM;CN;CO;CR;CU;CV;CW;CX;CY;CZ;DE;DJ;DK;DM;DO;DZ;EC;EE;EG;EH;ER;ES;ET;FI;FJ;FK;FM;FO;FR;GA;GB;GD;GE;GF;GG;GH;GI;GL;GM;GN;GP;GQ;GR;GS;GT;GU;GW;GY;HK;HM;HN;HR;HT;HU;ID;IE;IL;IM;IN;IO;IQ;IR;IS;IT;JE;JM;JO;JP;KE;KG;KH;KI;KM;KN;KP;KR;KW;KY;KZ;LA;LB;LC;LI;LK;LR;LS;LT;LU;LV;LY;MA;MC;MD;ME;MF;MG;MH;MK;ML;MM;MN;MO;MP;MQ;MR;MS;MT;MU;MV;MW;MX;MY;MZ;NA;NC;NE;NF;NG;NI;NL;NO;NP;NR;NU;NZ;OM;PA;PE;PF;PG;PH;PK;PL;PM;PN;PR;PS;PT;PW;PY;QA;RE;RO;RS;RU;RW;SA;SB;SC;SD;SE;SG;SH;SI;SJ;SK;SL;SM;SN;SO;SR;SS;ST;SV;SX;SY;SZ;TC;TD;TF;TG;TH;TJ;TK;TL;TM;TN;TO;TR;TT;TV;TW;TZ;UA;UG;UM;US;UY;UZ;VA;VC;VE;VG;VI;VN;VU;WF;WS;YE;YT;ZA;ZM;ZW	1040884	2017-05-24	2017-05-24	News & Politics	27639	1804	/watch?v=DkZ7BJQupVA	https://www.youtube.com/watch?v=/watch?v=DkZ7BJQupVA	DkZ7BJQupVA;-fUDIucr2eo;S7BycrGnaJA;ENw2y0ek1Jg;sxiKlOK3EJY;GxIDJWCbk6I;76J66qzJS5A;stXgn2iZAAY;7uiv6tKtoKg;_ES8x6_vxqc;8VJ2ltCN4eo;fKK9nVLvhGM;lOT0GOyw2pY;s8VOM8ET1WU;poPLSgbSO6k;rI_Iy1FoSn4;wFqQm1541aA;kXCGbAv8YPw;2lR7s1Y6Zig;ND0D3bVbM7Y	https://www.youtube.com/watch?v=DkZ7BJQupVA;https://www.youtube.com/watch?v=-fUDIucr2eo;https://www.youtube.com/watch?v=S7BycrGnaJA;https://www.youtube.com/watch?v=ENw2y0ek1Jg;https://www.youtube.com/watch?v=sxiKlOK3EJY;https://www.youtube.com/watch?v=GxIDJWCbk6I;https://www.youtube.com/watch?v=76J66qzJS5A;https://www.youtube.com/watch?v=stXgn2iZAAY;https://www.youtube.com/watch?v=7uiv6tKtoKg;https://www.youtube.com/watch?v=_ES8x6_vxqc;https://www.youtube.com/watch?v=8VJ2ltCN4eo;https://www.youtube.com/watch?v=fKK9nVLvhGM;https://www.youtube.com/watch?v=lOT0GOyw2pY;https://www.youtube.com/watch?v=s8VOM8ET1WU;https://www.youtube.com/watch?v=poPLSgbSO6k;https://www.youtube.com/watch?v=rI_Iy1FoSn4;https://www.youtube.com/watch?v=wFqQm1541aA;https://www.youtube.com/watch?v=kXCGbAv8YPw;https://www.youtube.com/watch?v=2lR7s1Y6Zig;https://www.youtube.com/watch?v=ND0D3bVbM7Y	Why humans are so bad at thinking about climate change;Comedians have figured out the trick to covering Trump;Why Costco is Cheaper than Amazon;The gun solution we're not talking about;The Angel Problem [Game Theory];The Green New Deal, explained;The new FRIENDSHIP between ISRAEL and the ARAB countries - VisualPolitik EN;These are the most confusing questions Congress asked Zuckerberg;What Will We Miss?;Will Apple Ever Leave China?;Glad You Asked | Official Trailer | YouTube Originals;How free games are designed to make money;The robot-proof job men aren't taking;How the Republican Party went from Lincoln to Trump;The fight to rethink (and reinvent) nuclear power;IndiaÃ¢Â Â s cow vigilantes are targeting Muslims;Teaching in the US vs. the rest of the world;Who pays the lowest taxes in the US?;What Does Earth Look Like?;Wildlife crossings stop roadkill. Why aren't there more?	UCLXo7UDZvByw2ixzpQCufnA;UCgNg3vwj3xt7QOrcIDaHdFg;UCLXo7UDZvByw2ixzpQCufnA;UCrv269YwJzuZL3dH5PCgxUw;UCLXo7UDZvByw2ixzpQCufnA;UCT3v6vL2H5HK4loLMc8pmCw;UCe-4xQosMQGkIA8mT4sR98Q;UC6nSFpj9HTCZ5t-N3Rm3-HA;UCgNg3vwj3xt7QOrcIDaHdFg;UCLXo7UDZvByw2ixzpQCufnA;UCLXo7UDZvByw2ixzpQCufnA;UCLXo7UDZvByw2ixzpQCufnA;UCLXo7UDZvByw2ixzpQCufnA;UCLXo7UDZvByw2ixzpQCufnA;UCLXo7UDZvByw2ixzpQCufnA;UCLXo7UDZvByw2ixzpQCufnA;UC6nSFpj9HTCZ5t-N3Rm3-HA;UCLXo7UDZvByw2ixzpQCufnA	Vox;Vox;PolyMatter;Vox;CodeParade;Vox;VisualPolitik EN;CNN Business;Vsauce;PolyMatter;Vox;Vox;Vox;Vox;Vox;Vox;Vox;Vox;Vsauce;Vox	585;414;537;388;209;450;960;203;589;625;0;279;513;441;491;898;279;351;648;397	1774544;3738170;2185314;1749080;2320067;1416438;407967;7415614;23131082;802135;3023483;3746706;1697676;6097101;1539563;1791520;2034367;1880281;11830046;1723311	36;36;7;8;12;11;12;24;72;10;8;36;24;36;36;10;4;5;72;24	Why humans are so bad at thinking about climate change by Vox 3 years ago 9 minutes, 45 seconds 1,774,544 views;Comedians have figured out the trick to covering Trump by Vox 3 years ago 6 minutes, 54 seconds 3,738,170 views;Why Costco is Cheaper than Amazon by PolyMatter 7 months ago 8 minutes, 57 seconds 2,185,314 views;The gun solution we're not talking about by Vox 8 months ago 6 minutes, 28 seconds 1,749,080 views;The Angel Problem [Game Theory] by CodeParade 1 year ago 3 minutes, 29 seconds 2,320,067 views;The Green New Deal, explained by Vox 11 months ago 7 minutes, 30 seconds 1,416,438 views;The new FRIENDSHIP between ISRAEL and the ARAB countries - VisualPolitik EN by VisualPolitik EN 1 year ago 16 minutes 407,967 views;These are the most confusing questions Congress asked Zuckerberg by CNN Business 2 years ago 3 minutes, 23 seconds 7,415,614 views;What Will We Miss? by Vsauce 6 years ago 9 minutes, 49 seconds 23,131,082 views;Will Apple Ever Leave China? by PolyMatter 10 months ago 10 minutes, 25 seconds 802,135 views;Glad You Asked | Official Trailer | YouTube Originals by Vox 8 months ago 3,023,483 views;How free games are designed to make money by Vox 3 years ago 4 minutes, 39 seconds 3,746,706 views;The robot-proof job men aren't taking by Vox 2 years ago 8 minutes, 33 seconds 1,697,676 views;How the Republican Party went from Lincoln to Trump by Vox 3 years ago 7 minutes, 21 seconds 6,097,101 views;The fight to rethink (and reinvent) nuclear power by Vox 3 years ago 8 minutes, 11 seconds 1,539,563 views;IndiaÃ¢Â Â s cow vigilantes are targeting Muslims by Vox 10 months ago 14 minutes, 58 seconds 1,791,520 views;Teaching in the US vs. the rest of the world by Vox 4 months ago 4 minutes, 39 seconds 2,034,367 views;Who pays the lowest taxes in the US? by Vox 5 months ago 5 minutes, 51 seconds 1,880,281 views;What Does Earth Look Like? by Vsauce 6 years ago 10 minutes, 48 seconds 11,830,046 views;Wildlife crossings stop roadkill. Why aren't there more? by Vox 2 years ago 6 minutes, 37 seconds 1,723,311 views
climate science	48	DkZ7BJQupVA	https://www.youtube.com/watch?v=DkZ7BJQupVA	Why humans are so bad at thinking about climate change	The biggest problem for the climate change fight isn t technology it s human psychology. This is the first episode of Climate Lab, a six-part series produc...	vox.com; vox; explain; university of california; environment; climate change; apathy; psychology; science; earth day; climate lab; sustainability; renewable ...	https://i.ytimg.com/vi/DkZ7BJQupVA/maxresdefault.jpg	video.other	False	UCLXo7UDZvByw2ixzpQCufnA	PT9M45S	False	True	AD;AE;AF;AG;AI;AL;AM;AO;AQ;AR;AS;AT;AU;AW;AX;AZ;BA;BB;BD;BE;BF;BG;BH;BI;BJ;BL;BM;BN;BO;BQ;BR;BS;BT;BV;BW;BY;BZ;CA;CC;CD;CF;CG;CH;CI;CK;CL;CM;CN;CO;CR;CU;CV;CW;CX;CY;CZ;DE;DJ;DK;DM;DO;DZ;EC;EE;EG;EH;ER;ES;ET;FI;FJ;FK;FM;FO;FR;GA;GB;GD;GE;GF;GG;GH;GI;GL;GM;GN;GP;GQ;GR;GS;GT;GU;GW;GY;HK;HM;HN;HR;HT;HU;ID;IE;IL;IM;IN;IO;IQ;IR;IS;IT;JE;JM;JO;JP;KE;KG;KH;KI;KM;KN;KP;KR;KW;KY;KZ;LA;LB;LC;LI;LK;LR;LS;LT;LU;LV;LY;MA;MC;MD;ME;MF;MG;MH;MK;ML;MM;MN;MO;MP;MQ;MR;MS;MT;MU;MV;MW;MX;MY;MZ;NA;NC;NE;NF;NG;NI;NL;NO;NP;NR;NU;NZ;OM;PA;PE;PF;PG;PH;PK;PL;PM;PN;PR;PS;PT;PW;PY;QA;RE;RO;RS;RU;RW;SA;SB;SC;SD;SE;SG;SH;SI;SJ;SK;SL;SM;SN;SO;SR;SS;ST;SV;SX;SY;SZ;TC;TD;TF;TG;TH;TJ;TK;TL;TM;TN;TO;TR;TT;TV;TW;TZ;UA;UG;UM;US;UY;UZ;VA;VC;VE;VG;VI;VN;VU;WF;WS;YE;YT;ZA;ZM;ZW	1774544	2017-04-19	2017-04-19	Entertainment	59421	2564	/watch?v=0Puv0Pss33M	https://www.youtube.com/watch?v=/watch?v=0Puv0Pss33M	0Puv0Pss33M;dcBXmj1nMTQ;kXCGbAv8YPw;ztWHqUFJRTs;BxKfpt70rLI;6RlxySFrkIM;S7BycrGnaJA;GxIDJWCbk6I;Sv7OHfpIRfU;o2dvXWX3Sdw;1UnIDL-eHOs;ENw2y0ek1Jg;XnK5mG5u8Hg;b6CPsGanO_U;2yzMUs3badc;mS9CFBlLOcg;8VJ2ltCN4eo;eXTiiz99p9o;TUmyygCMMGA;EZSCtgfmEO0	https://www.youtube.com/watch?v=0Puv0Pss33M;https://www.youtube.com/watch?v=dcBXmj1nMTQ;https://www.youtube.com/watch?v=kXCGbAv8YPw;https://www.youtube.com/watch?v=ztWHqUFJRTs;https://www.youtube.com/watch?v=BxKfpt70rLI;https://www.youtube.com/watch?v=6RlxySFrkIM;https://www.youtube.com/watch?v=S7BycrGnaJA;https://www.youtube.com/watch?v=GxIDJWCbk6I;https://www.youtube.com/watch?v=Sv7OHfpIRfU;https://www.youtube.com/watch?v=o2dvXWX3Sdw;https://www.youtube.com/watch?v=1UnIDL-eHOs;https://www.youtube.com/watch?v=ENw2y0ek1Jg;https://www.youtube.com/watch?v=XnK5mG5u8Hg;https://www.youtube.com/watch?v=b6CPsGanO_U;https://www.youtube.com/watch?v=2yzMUs3badc;https://www.youtube.com/watch?v=mS9CFBlLOcg;https://www.youtube.com/watch?v=8VJ2ltCN4eo;https://www.youtube.com/watch?v=eXTiiz99p9o;https://www.youtube.com/watch?v=TUmyygCMMGA;https://www.youtube.com/watch?v=EZSCtgfmEO0	How to Save Our Planet;What is Climate Change? | Start Here;Who pays the lowest taxes in the US?;Climate change: Earth's giant game of Tetris - Joss Fong;Going green shouldn't be this hard;Food waste is the world's dumbest problem;Why Costco is Cheaper than Amazon;The Green New Deal, explained;Climate change (according to a kid);We need to change how we bury the dead;Why we say Ã¢Â Â OKÃ¢Â Â;The gun solution we're not talking about;2019, in 6 minutes;What If All The Ice Melted On Earth? ft. Bill Nye;Why some Asian accents swap Ls and Rs in English;Why Billionaires WonÃ¢Â Â t Save Us | Patriot Act with Hasan Minhaj | Netflix;Glad You Asked | Official Trailer | YouTube Originals;The science is in: Exercise isnÃ¢Â Â t the best way to lose weight;The big debate about the future of work, explained;NASA's plan to save Earth from a giant asteroid	UC5MDIy3yhWDrx0MyDo4QmYg;UCNye-wNBqNL5ZzHSJj3l8Bg;UCLXo7UDZvByw2ixzpQCufnA;UCsooa4yRKGN_zEE8iknghZA;UCLXo7UDZvByw2ixzpQCufnA;UCLXo7UDZvByw2ixzpQCufnA;UCgNg3vwj3xt7QOrcIDaHdFg;UCLXo7UDZvByw2ixzpQCufnA;UCdnZdQxYXnbN4uWJg96oGxw;UCLXo7UDZvByw2ixzpQCufnA;UCLXo7UDZvByw2ixzpQCufnA;UCLXo7UDZvByw2ixzpQCufnA;UCLXo7UDZvByw2ixzpQCufnA;UCC552Sd-3nyi_tk2BudLUzA;UCLXo7UDZvByw2ixzpQCufnA;UCarEovlrD9QY-fy-Z6apIDQ;UCLXo7UDZvByw2ixzpQCufnA;UCLXo7UDZvByw2ixzpQCufnA;UCLXo7UDZvByw2ixzpQCufnA;UCLXo7UDZvByw2ixzpQCufnA	WWF International;Al Jazeera English;Vox;TED-Ed;Vox;Vox;PolyMatter;Vox;Rappler;Vox;Vox;Vox;Vox;AsapSCIENCE;Vox;Patriot Act;Vox;Vox;Vox;Vox	508;427;351;169;539;562;537;450;132;352;322;388;406;351;537;1500;0;297;543;389	889080;170302;1880281;638992;4731844;2548617;2185314;1416438;685838;5863611;5606699;1749080;3005203;6834366;2296017;2255102;3023483;8314427;1913505;6814745	12;5;5;72;36;36;7;11;48;24;12;8;4;36;12;5;8;36;24;24	How to Save Our Planet by WWF International 1 year ago 8 minutes, 28 seconds 889,080 views;What is Climate Change? | Start Here by Al Jazeera English 5 months ago 7 minutes, 7 seconds 170,302 views;Who pays the lowest taxes in the US? by Vox 5 months ago 5 minutes, 51 seconds 1,880,281 views;Climate change: Earth's giant game of Tetris - Joss Fong by TED-Ed 6 years ago 2 minutes, 49 seconds 638,992 views;Going green shouldn't be this hard by Vox 3 years ago 8 minutes, 59 seconds 4,731,844 views;Food waste is the world's dumbest problem by Vox 3 years ago 9 minutes, 22 seconds 2,548,617 views;Why Costco is Cheaper than Amazon by PolyMatter 7 months ago 8 minutes, 57 seconds 2,185,314 views;The Green New Deal, explained by Vox 11 months ago 7 minutes, 30 seconds 1,416,438 views;Climate change (according to a kid) by Rappler 4 years ago 2 minutes, 12 seconds 685,838 views;We need to change how we bury the dead by Vox 2 years ago 5 minutes, 52 seconds 5,863,611 views;Why we say Ã¢Â Â OKÃ¢Â Â by Vox 1 year ago 5 minutes, 22 seconds 5,606,699 views;The gun solution we're not talking about by Vox 8 months ago 6 minutes, 28 seconds 1,749,080 views;2019, in 6 minutes by Vox 4 months ago 6 minutes, 46 seconds 3,005,203 views;What If All The Ice Melted On Earth? ft. Bill Nye by AsapSCIENCE 3 years ago 5 minutes, 51 seconds 6,834,366 views;Why some Asian accents swap Ls and Rs in English by Vox 1 year ago 8 minutes, 57 seconds 2,296,017 views;Why Billionaires WonÃ¢Â Â t Save Us | Patriot Act with Hasan Minhaj | Netflix by Patriot Act 5 months ago 25 minutes 2,255,102 views;Glad You Asked | Official Trailer | YouTube Originals by Vox 8 months ago 3,023,483 views;The science is in: Exercise isnÃ¢Â Â t the best way to lose weight by Vox 3 years ago 4 minutes, 57 seconds 8,314,427 views;The big debate about the future of work, explained by Vox 2 years ago 9 minutes, 3 seconds 1,913,505 views;NASA's plan to save Earth from a giant asteroid by Vox 2 years ago 6 minutes, 29 seconds 6,814,745 views
climate change	1	K7lzhYTg94s	https://www.youtube.com/watch?v=K7lzhYTg94s	Why politicians have failed to tackle climate change | The Economist	Climate change is now recognised as the defining threat facing the planet. So why has so little been done to tackle it? Read more here: https://econ.st/3gevR...	The Economist; Economist; Economist Films; Economist Videos; Politics; News; short-documentary; climate change; global warming; climate; science; environment...	https://i.ytimg.com/vi/K7lzhYTg94s/hqdefault.jpg	video.other	False	UC0p5jTq6Xx_DosDFxVXnWaQ	PT9M5S	False	True	AD;AE;AF;AG;AI;AL;AM;AO;AQ;AR;AS;AT;AU;AW;AX;AZ;BA;BB;BD;BE;BF;BG;BH;BI;BJ;BL;BM;BN;BO;BQ;BR;BS;BT;BV;BW;BY;BZ;CA;CC;CD;CF;CG;CH;CI;CK;CL;CM;CN;CO;CR;CU;CV;CW;CX;CY;CZ;DE;DJ;DK;DM;DO;DZ;EC;EE;EG;EH;ER;ES;ET;FI;FJ;FK;FM;FO;FR;GA;GB;GD;GE;GF;GG;GH;GI;GL;GM;GN;GP;GQ;GR;GS;GT;GU;GW;GY;HK;HM;HN;HR;HT;HU;ID;IE;IL;IM;IN;IO;IQ;IR;IS;IT;JE;JM;JO;JP;KE;KG;KH;KI;KM;KN;KP;KR;KW;KY;KZ;LA;LB;LC;LI;LK;LR;LS;LT;LU;LV;LY;MA;MC;MD;ME;MF;MG;MH;MK;ML;MM;MN;MO;MP;MQ;MR;MS;MT;MU;MV;MW;MX;MY;MZ;NA;NC;NE;NF;NG;NI;NL;NO;NP;NR;NU;NZ;OM;PA;PE;PF;PG;PH;PK;PL;PM;PN;PR;PS;PT;PW;PY;QA;RE;RO;RS;RU;RW;SA;SB;SC;SD;SE;SG;SH;SI;SJ;SK;SL;SM;SN;SO;SR;SS;ST;SV;SX;SY;SZ;TC;TD;TF;TG;TH;TJ;TK;TL;TM;TN;TO;TR;TT;TV;TW;TZ;UA;UG;UM;US;UY;UZ;VA;VC;VE;VG;VI;VN;VU;WF;WS;YE;YT;ZA;ZM;ZW	39196	2020-05-22	2020-05-22	News & Politics	1276	149	/watch?v=QaN6ibm5r-I	https://www.youtube.com/watch?v=/watch?v=QaN6ibm5r-I	QaN6ibm5r-I;r9PaRFtlLmc;OKKbkS_LOu4;1ylleTbizgU;VfKfSUqn_GY;p8fl-u1UMVA;D7EdgCxFZ8Q;gUc5oN_ffRo;DkZ7BJQupVA;kkVEt5tC2xU;q2ZRT0TmVB0;XsArdIXgRTU;cl4Uv9_7KJE;JiYVoHEV5hs;41y4c1Oi5Uo;TMmDebW_OBI;ErwIlvQ_RVk;RzVV2fbkKtk;dcBXmj1nMTQ;eTgNgGO_bLs	https://www.youtube.com/watch?v=QaN6ibm5r-I;https://www.youtube.com/watch?v=r9PaRFtlLmc;https://www.youtube.com/watch?v=OKKbkS_LOu4;https://www.youtube.com/watch?v=1ylleTbizgU;https://www.youtube.com/watch?v=VfKfSUqn_GY;https://www.youtube.com/watch?v=p8fl-u1UMVA;https://www.youtube.com/watch?v=D7EdgCxFZ8Q;https://www.youtube.com/watch?v=gUc5oN_ffRo;https://www.youtube.com/watch?v=DkZ7BJQupVA;https://www.youtube.com/watch?v=kkVEt5tC2xU;https://www.youtube.com/watch?v=q2ZRT0TmVB0;https://www.youtube.com/watch?v=XsArdIXgRTU;https://www.youtube.com/watch?v=cl4Uv9_7KJE;https://www.youtube.com/watch?v=JiYVoHEV5hs;https://www.youtube.com/watch?v=41y4c1Oi5Uo;https://www.youtube.com/watch?v=TMmDebW_OBI;https://www.youtube.com/watch?v=ErwIlvQ_RVk;https://www.youtube.com/watch?v=RzVV2fbkKtk;https://www.youtube.com/watch?v=dcBXmj1nMTQ;https://www.youtube.com/watch?v=eTgNgGO_bLs	Charity: how effective is giving? | The Economist;How can banks be used to stop human trafficking? | The Economist;Why does time pass? | The Economist;Is America right to fear Huawei? | The Economist;How covid-19 could change the financial world order | The Economist;How Africa could one day rival China | The Economist;How to stop plastic getting into the ocean | The Economist;The future of work: is your job safe? | The Economist;Why humans are so bad at thinking about climate change;How an obsession with home ownership can ruin the economy | The Economist;How to get migration right | The Economist;Covid-19: how it will change the world | The Economist;Fleeing climate change Ã¢Â Â the real environmental disaster | DW Documentary;Why is chicken so cheap? | The Economist;Why The Inequality Gap Is Growing Between Rich And Poor;Was Karl Marx right? | The Economist;America v China: why the trade war won't end soon | The Economist;Scientist reacts to YouTube climate change comments #2;What is Climate Change? | Start Here;What happens when we sleep? | The Economist	UC0p5jTq6Xx_DosDFxVXnWaQ;UC0p5jTq6Xx_DosDFxVXnWaQ;UC0p5jTq6Xx_DosDFxVXnWaQ;UC0p5jTq6Xx_DosDFxVXnWaQ;UC0p5jTq6Xx_DosDFxVXnWaQ;UC0p5jTq6Xx_DosDFxVXnWaQ;UC0p5jTq6Xx_DosDFxVXnWaQ;UC0p5jTq6Xx_DosDFxVXnWaQ;UCLXo7UDZvByw2ixzpQCufnA;UC0p5jTq6Xx_DosDFxVXnWaQ;UC0p5jTq6Xx_DosDFxVXnWaQ;UC0p5jTq6Xx_DosDFxVXnWaQ;UCW39zufHfsuGgpLviKh297Q;UC0p5jTq6Xx_DosDFxVXnWaQ;UCvJJ_dzjViJCoLf5uKUTwoA;UC0p5jTq6Xx_DosDFxVXnWaQ;UC0p5jTq6Xx_DosDFxVXnWaQ;UCRRr_xrOm66qaigIbwFLvbQ;UCNye-wNBqNL5ZzHSJj3l8Bg;UC0p5jTq6Xx_DosDFxVXnWaQ	The Economist;The Economist;The Economist;The Economist;The Economist;The Economist;The Economist;The Economist;Vox;The Economist;The Economist;The Economist;DW Documentary;The Economist;CNBC;The Economist;The Economist;Simon Clark;Al Jazeera English;The Economist	1560;1740;630;598;598;900;530;1140;585;770;647;778;2520;384;487;203;558;714;427;165	166172;93866;3113226;1541657;962788;450181;281730;485874;1774524;597895;148160;412951;575259;2841549;482867;796313;1244196;39994;170276;124048	3;24;48;6;0;1;0;12;36;4;5;0;12;12;11;24;6;1;5;12	Charity: how effective is giving? | The Economist by The Economist 3 months ago 26 minutes 166,172 views;How can banks be used to stop human trafficking? | The Economist by The Economist 2 years ago 29 minutes 93,866 views;Why does time pass? | The Economist by The Economist 4 years ago 10 minutes, 30 seconds 3,113,226 views;Is America right to fear Huawei? | The Economist by The Economist 6 months ago 9 minutes, 58 seconds 1,541,657 views;How covid-19 could change the financial world order | The Economist by The Economist 1 week ago 9 minutes, 58 seconds 962,788 views;How Africa could one day rival China | The Economist by The Economist 1 month ago 15 minutes 450,181 views;How to stop plastic getting into the ocean | The Economist by The Economist 3 weeks ago 8 minutes, 50 seconds 281,730 views;The future of work: is your job safe? | The Economist by The Economist 1 year ago 19 minutes 485,874 views;Why humans are so bad at thinking about climate change by Vox 3 years ago 9 minutes, 45 seconds 1,774,524 views;How an obsession with home ownership can ruin the economy | The Economist by The Economist 4 months ago 12 minutes, 50 seconds 597,895 views;How to get migration right | The Economist by The Economist 5 months ago 10 minutes, 47 seconds 148,160 views;Covid-19: how it will change the world | The Economist by The Economist 2 weeks ago 12 minutes, 58 seconds 412,951 views;Fleeing climate change Ã¢Â Â the real environmental disaster | DW Documentary by DW Documentary 1 year ago 42 minutes 575,259 views;Why is chicken so cheap? | The Economist by The Economist 1 year ago 6 minutes, 24 seconds 2,841,549 views;Why The Inequality Gap Is Growing Between Rich And Poor by CNBC 11 months ago 8 minutes, 7 seconds 482,867 views;Was Karl Marx right? | The Economist by The Economist 2 years ago 3 minutes, 23 seconds 796,313 views;America v China: why the trade war won't end soon | The Economist by The Economist 6 months ago 9 minutes, 18 seconds 1,244,196 views;Scientist reacts to YouTube climate change comments #2 by Simon Clark 1 month ago 11 minutes, 54 seconds 39,994 views;What is Climate Change? | Start Here by Al Jazeera English 5 months ago 7 minutes, 7 seconds 170,276 views;What happens when we sleep? | The Economist by The Economist 1 year ago 2 minutes, 45 seconds 124,048 views
